Judul,Harga,Penulis,Genre,Stock,Berat,Cetakan,Bulan,Tahun,Lebar,Panjang,Tebal,Format,ISBN,Sinopsis,Tentang_penulis,Foto Produk1,Foto Produk2
Sebuah Pelajaran tentang Berhemat; dan Bagaimana Menghindari Akibat Buruk dari Pemborosan dan  Ketamakan,99000.0,Samuel Smiles, Pengembangan Diri,30,532," I, Desember 2020",Desember,2020,13.0,20.0,432,, 978-623-7162-70-4,"Dewasa ini—karena pengaruh gaya hidup masyarakat—tingkat konsumsi masyarakat terus naik, kebutuhan menjadi membengkak, dan penghasilan seakan tidak pernah cukup untuk memenuhi kebutuhan hidup. Apalagi di kalangan milenial, terutama yang tinggal di kawasan metropolitan, hal ini sangatlah terasa. Berdalih mengikuti tren, para anak muda sangat sulit untuk bisa menjalani gaya hidup hemat. 

Buku ini menunjukkan kepada Anda tentang manfaat berhemat dan bahaya pemborosan, sebuah pelajaran klasik yang tetap sangat relevan hingga hari ini. Menyajikan banyak contoh dan pepatah dari orang-orang terkenal, penulis memotivasi Anda untuk memiliki visi dan tanggung jawab dalam penggunaan uang serta memberikan tips-tips untuk memanfaatkan uang dengan benar dan efisien.

Melalui buku ini, Samuel Smiles mendorong Anda supaya mengerahkan harta untuk tujuan yang berguna dan tidak menyia-nyiakannya untuk kesenangan belaka, serta mengajarkan supaya Anda bisa menabung, keluar dari lilitan utang, dan tak punya beban dalam kehidupan terkait keuangan.

***


“Masyarakat lebih menderita karena pemborosan daripada karena kekurangan uang.”

—Samuel Smiles

 “Sebagian besar orang bekerja untuk masa sekarang, namun sedikit yang bekerja untuk masa depan. Orang bijak bekerja untuk keduanya—untuk masa depan di masa sekarang, dan untuk masa sekarang di masa depan.”

—Julius Charles Hare, dalam Guesses at Truth


 
“Mendalam dan menginspirasi. Saya telah membaca seluruh buku ini. Buku ini menunjukkan prinsip-prinsip yang membantu memerangi mentalitas konsumerisme yang begitu menggejala saat ini.”

—Heidi J, Amazon.com","Samuel Smiles (23 Desember 1812-16 April 1904) adalah seorang penulis Skotlandia dan pembaharu pemerintahan. Ia lahir di Haddington, East Lothian, Skotlandia. Ayahnya meninggal dalam wabah kolera tahun 1832. Berkat dukungan dari ibunya, Smiles dapat tetap melanjutkan pendidikannya. Ia belajar kedokteran di Universitas Edinburgh pada 1829.

Sewaktu remaja, ia menjalankan toko keluarga kecil dan bekerja tanpa henti untuk menghidupi dirinya dan sembilan adiknya. Hal ini yang membentuk karakter dan mempengaruhi karya-karyanya di kemudian hari.  

Karya-karyanya antara lain: Thrift (yang diterbitkan oleh Gemilang [Kelompok Pustaka Alvabet] dengan judul Sebuah Pelajaran tentang Berhemat). Karya Smiles yang lain yaitu: Self-Help (yang juga diterbitkan oleh Gemilang dengan judul yang sama), melalui karya inilah Smiles menginspirasi banyak orang, termasuk Orison Swett Marden, penulis inspirasional Amerika, yang mengaku telah membaca Self-Help selama masa mudanya dan telah menginspirasi kehidupan serta karya-karyanya, Character (1871), Duty (1880), dan Life and Labour (1887).",https://tokoalvabet.com/631-large_default/sebuah-pelajaran-tentang-berhemat-sc.jpg,https://tokoalvabet.com/632-large_default/sebuah-pelajaran-tentang-berhemat-sc.jpg
Sebuah Seni untuk Meyakinkan Orang,99000.0,G. Richard Shell dan Mario Moussa, Pengembangan Diri,50,572," 1, Januari 2022",Januari,2022,13.0,20.0,472,, 978-623-7162-51-3,"Ketika Napoleon Bonaparte masih seorang perwira pada penaklukan Toulon, dia merangkai sebuah senjata artileri di lokasi yang sangat terbuka dan berbahaya. Semua atasannya mengira dia tidak akan mendapatkan pasukan untuk mengoperasikan artileri itu. Bukannya memerintah atau menakut-nakuti para prajuritnya, Napoleon sendiri malah membuat plakat besar dan menempelkannya di samping meriam: “Senjata untuk Orang Tanpa Rasa Takut”. Posisi itu pun dijaga prajurit siang dan malam.
Itulah yang disebut “woo”: kemampuan mempengaruhi orang untuk mengikuti gagasan Anda tanpa memaksanya, melainkan menggunakan persuasi yang cerdas. Buku ini akan menunjukkan pada Anda bagaimana Charles Lindberg mengubah dirinya—dalam waktu kurang dari setahun—dari seorang pilot pengantar surat menjadi selebriti internasional, atau bagaimana Nelson Mandela menggunakan woo untuk mengambil hati para penjaga di penjaranya yang brutal dan menciptakan kembali sebuah bangsa. Buku ini juga menjelaskan bagaimana para pemimpin bisnis dari segala bidang menggunakan woo setiap hari untuk mencapai sasaran-sasaran mereka.
Tak peduli apakah Anda introver atau ekstrover, kompetitif atau kolaboratif, dari kalangan intelektual atau praktisi, Anda akan menemukan bahwa woo dapat menguatkan keterampilan persuasi Anda dalam setiap aspek kehidupan. Anda mungkin membutuhkan The Art of War-nya Sun Tzu untuk mengalahkan musuh. Tetapi jika Anda memilih untuk memenangkan hatinya, bacalah The Art of Woo. Inilah rahasia sukses dengan para kolega, klien, dan pelanggan.
***
“Anda mungkin punya gagasan brilian, tapi jika Anda tak bisa menyampaikannya dengan gamblang dan meyakinkan, gagasan itu tak akan membawa Anda ke mana-mana.”
—Lee Iacocca 
 “Karya klasik Dale Carnegie, How To Win Friends and Influence People, hingga kini tetap menjadi standar bagi para penjual. … Tetapi buku ini jelas lebih ringan, lebih cerdas, dan tentu saja lebih relevan di masa kini ketimbang buku tua Carnegie yang ditulis lebih dari tujuh puluh tahun silam.“—Library Journal
“Panduan yang menyenangkan dan berguna untuk memperoleh kekuatan woo. Buku ini membantu pembaca tidak saja di dunia profesionalisme.”—Publishers Weekly","G. RICHARD SHELL adalah Guru Besar Ilmu Hukum, Etika Bisnis dan Manajemen di Wharton School, University of Pennsylvania, AS. Di kampus ini, dia mengajar sejak 1986, dan kini men jadi direktur akademik di dua program pendidik an eksekutif Wharton: Workshop Negosiasi Ekse -kutif dan Workshop Persuasi Strategis. Business Week menyebutnya sebagai salah satu profesor sekolah bisnis terbaik di Amerika Serikat.
Sebagai konsultan, Profesor Shell telah bekerja untuk lebih dari 100 perusahaan dan organisasi nirlaba. Kliennya termasuk General Electric, Johnson & Johnson, Citibank, Hewlett-Packard, American Association of Medical College, dan United Food serta Commercial Workers International.
Artikel opininya tersebar di berbagai media massa, seperti Wall Street Journal, New York Times, Boston Globe, dan Philadelphia Inquirer. Karyanya, Bargaining for Advantage, memenangi penghargaan buku terbaik the CPR Institute for Dispute Resolution’s 1999.

MARIO MOUSSA adalah Direktur Akademik Wharton School of Exe -cutive Education dan Presiden Moussa Consulting. Sebelumnya ia menjabat Kepala CFAR Inc, sebuah firma konsultan manajemen. Moussa menyandang MBA dari Wharton School dan meraih Ph.D dari University of Chicago.
Dr. Moussa rutin memberikan presentasi dan workshop bagi para kliennya di seluruh dunia: berbicara di depan ribuan eksekutif di Hong Kong, Istanbul, Sao Paolo, Delhi, Mumbai, Paris, serta berbagai kota di Amerika Serikat. Dia juga telah memimpin proyek di United Health Group, Bristol-Myers Squibb, PNC Bank, Georgetown University Medical Center, dan State Farm Insurance.",https://tokoalvabet.com/713-large_default/sebuah-seni-untuk-meyakinkan-orang-cover-baru.jpg,
Sedekah Pengubah Nasib,59000.0,Aditya Akbar Hakim, Motivasi Islam,50,372," I, November 2020",November,2020,13.0,20.0,272,, 978-623-7163-49-7,"Buku ini menjelaskan secara gamblang bahwa segala kesulitan, apa pun bentuknya, yang kita alami sejatinya disebabkan oleh minimnya kita bersedekah. Kita terlampau banyak dan fokus meminta dan menuntut, tetapi lupa memberi dan berbagi. Sedekah itu tak hanya tentang pahala, tetapi juga tentang perubahan nasib: dari sulit menjadi mudah, dari berat menjadi ringan, dan seterusnya. Didasarkan pada ayat al-Quran, hadis Nabi, dan pandangan ulama, serta sejumlah cerita inspiratif tentang orang yang nasibnya berubah karena memberi, buku ini menegaskan kunci penting sedekah sebagai pembuka jalan hidup. Semakin banyak bersedekah, semakin baik pula nasib kita.","ADITYA AKBAR HAKIM. Pria kelahiran Pudak, Gresik, Jawa Timur, dari pasangan Bapak Mutamakin dan Ibu Chumrotul Wasiah. Menyelesaikan studi di Universitas Negeri Surabaya tahun 2013. Suami dari Faidatur Robiah dan ayah dari Radiv Himada ini sangat produktif menulis dan menyunting buku. Di antara buah karyanya: Quantum Belajar: Membangun Gelora untuk Hidup Bahagia (Genius Media, 2016), Jaring Kearifan: Bahagianya Berislam dengan Santun (Suara Muhammadiyah, 2017), Finansial Keluarga Islami: Mengajarkan Anak Mengelola Uang Sejak Dini Sesuai Tuntunan Syari (Quanta, 2018), Rahasia Meraih Nikmat Dunia Akhirat (Quanta, 2019)",https://tokoalvabet.com/595-large_default/sedekah-pengubah-nasib.jpg,https://tokoalvabet.com/319-large_default/sedekah-pengubah-nasib.jpg
Sejarah Arab Sebelum Islam,199000.0,Dr. Jawwad Ali, Sejarah,19,950," I, April 2018",April,2018,15.0,23.0,850,, 978-623-7163-49-7,"Sejarah Arab Sebelum Islam


 
(1) Geografi, Iklim, Karakteristik, dan Silsilah (2) Daulah, Mamlakah, Kabilah, dan Imarah (3) Daulah, Mamlakah, Kabilah, dan Imarah [Lanjutan] (4) Kondisi Sosial-Budaya (5) Politik, Hukum, dan Tata Pemerintahan (6) Agama dan Kepercayaan (7) Sumber Daya Alam dan Perekonomian (8) Bahasa dan Literasi (9) Kesusastraan


 
Arab adalah salah satu peradaban penting dan berpengaruh yang pernah ada—bahkan sampai sekarang—di dunia. Ketermasyhuran Arab tidak hanya ada pada masa Islam, tetapi juga pada zaman kuno sebelum kemunculan Islam dan ekspansi kaum Muslim ke negeri-negeri lain melalui penaklukan. Sejarah peradaban Arab-Islam telah banyak kita ketahui. Tetapi, riwayat Arab kuno sebelum Islam mungkin tak banyak yang paham. Seperti apakah “wajah” Arab sebelum Islam?


 

 
Dalam buku yang terbagi sembilan jilid ini, Jawwad Ali, seorang sejarawan masyhur, mengisahkan secara gamblang riwayat (bangsa) Arab kuno dari berbagai aspek: geografi, iklim, karakteristik, silsilah; politik, hukum, dan pemerintahan; sosial-budaya; agama dan kepercayaan; sumber daya alam dan perekonomian; bahkan bahasa, literasi, dan kesusastraan. Merujuk pada sumber-sumber klasik seperti manuskrip-manuskrip, artefak-artefak, catatan-catatan orang Yunani, Romawi, Ahli Kitab (Yahudi), serta ditopang penemuan mutakhir ahli arkeologi, buku ini memaparkan dengan narasi yang lugas, deskripsi yang jelas, pengamatan mendalam dan penjelasan komprehensif perihal bangsa Arab kuno sebelum Islam.


 

 
***


 

 
“Jawwad Ali adalah sejarawan besar Arab abad ini. Ia dikenal dengan karya-karyanya yang kuat secara referensi dan analisis sehingga membuat dirinya berada di jajaran atas sejarawan terkemuka Arab dan dunia.” —Dr. Khaldun Darwisy Luthfi, al-Mu’arrikh al-‘Arabi


 

 
“Mempelajari sejarah Arab sebelum Islam dan karakter masyarakatnya, sejarawan Jawwad Ali pastilah orang pertama yang terbetik di benak kita. Ia layak berbangga hati dengan karyanya yang sangat fenomenal ini.” —Dr. Ibrahim Khalil al-‘Allaf, Pengajar Sejarah Kontemporer di Universitas Mosul, Irak


 
“Jawwad Ali adalah harta karun pengetahuan yang tak terkunci, sungai yang meluap dengan ilmu dan bakat. Lewat buku ini, ia menjelaskan masyarakat Arab sebagai tubuh yang diorganisasi dari sekumpulan ikatan dan hubungan ekonomi, sosial, etnisitas, dan pemikiran yang beragam.” —Jamal Hasan al-‘Attabi, Kritikus Sejarah dan Kebudayaan Arab","Dr. Jawwad Ali adalah salah satu sejarawan besar Irak dan Arab abad ini. Pria kelahiran Kazimain, Bagdad, Irak, 1907, ini meraih gelar doktor dalam bidang Sejarah Islam dari Universitas Hamburgh, Jerman, pada 1939. Ia kemudian mengabdikan diri di dunia akademis sebagai dosen pada Jurusan Sejarah Fakultas Tarbiyah Universitas Bagdad. Juga dosen di berbagai perguruan tinggi baik di Arab maupun di luar Arab. Pada 1957, ia menjadi dosen tamu pada Universitas Harvard Amerika. Setelah pensiun, ia mendapat gelar kehormatan “Profesor Emeritus” dari Universitas Bagdad. Ini adalah gelar paling prestisius yang dianugerahkan kepada intelektual Irak. Ia kerap kali menjadi pembicara pada berbagai seminar internasional, seperti seminar orientalis di Jerman. Ia juga menjadi salah satu anggota organisasi arkeologi Jerman. Ia meninggal dunia pada 1987.


 

 
Beberapa karya monumentalnya antara lain: at-Târîkh al-‘Âm (1927), Ashnâm al-‘Arab (1967); Mausû‘ah Târîkh al-‘Arab qabla al-Islâm (1956-1960) (8 volume), al-Mufashshal fî Târîkh al-‘Arab qabla al-Islâm (1968-1974) (10 volume) yang diterjemahkan ke dalam bahasa Indonesia oleh Pustaka Alvabet (2018), Târîkh ash-Shalâh fî al-Islâm (1968), Târîkh al-‘Arab fî al-Islâm (1969), dan al-Mahdiy wa Safrâ’uh al-Arba‘ah (1938) yang merupakan disertasi doktornya di Universitas Hamburg, Jerman. Karyanya yang belum dipublikasikan antara lain Mu‘jam Alfâzh al-Musnad, tentang indeks kosakata dan istilah Arab kuno yang disebut dengan aksara musnad.",https://tokoalvabet.com/79-large_default/sejarah-arab-sebelum-islam-jilid-1.jpg,
Sejuta Surat Cinta,45000.0,Jodi Ann Bickley, Kisah Nyata,20,372," I, Agustus 2014",Agustus,2014,13.0,20.0,272,, 978-602-9193-67-1,"daan Putus Asa, Satu Surat yang Menginspirasi Dapat Mengubah Hidup Anda!
Pada musim panas 2011, dalam usia 22, Jodi Ann Bickley mengidap penyakit serius yang akan mengubah kehidupannya selamanya. Kala itu, dengan penuh semangat, Jodi tampil di Camp Bestival di Pulau Wight, Inggris. Kembali ke rumah dengan penuh kegembiraan, dengan lagu band favoritnya masih mengalun di kepalanya, dia membayangkan kenangan indah itu akan bertahan abadi. Namun, seminggu kemudian, dia menggeliat kesakitan di lantai ruang praktek dokter: dia divonis mengidap infeksi otak akut akibat gigitan serangga.
Hari-hari yang panjang berikutnya, Jodi berjuang keras memulihkan kesehatannya yang naik-turun. Penyakit itu terlalu berat untuknya, dan dia bertanya-tanya apakah dirinya sanggup bertahan. Dia punya dua pilihan: menyerah seketika itu; atau melakukan sesuatu yang berarti dengan waktu yang ia miliki. Jodi memilih yang terakhir, dengan menulis “surat cinta” yang dia peruntukkan bagi mereka yang tengah menderita.
Sejuta Surat Cinta adalah kisah inspirasional bagaimana seseorang mengubah takdir hidupnya. Kisah Jodi dalam buku ini menjadi bukti nyata ihwal kekuatan dan keajaiban kata-kata yang menyembuhkan. Inilah surat menyentuh yang telah menggugah jutaan orang, dan menginspirasi kehidupan mereka.
 
“Berusaha keluar dari rasa sakitnya, setiap hari dia duduk dan menulis surat kepada orang-orang yang menderita depresi, perceraian, dan teralienasi. Sungguh menggugah!”
—Lucy Cavendish, Telegraph

“Dalam rangka menyembuhkan dirinya, Jodi bergerak menyembuhkan dunia, dengan surat bertulisan tangan sederhana, dihiasi dengan hati yang bahagia, serta ditaburi kata-kata optimis.”
—Bel Mooney, Daily Mail

“Bacaan yang fantastis, berkat kata-kata yang fantastis pula.”
—Ed Sheeran",,https://tokoalvabet.com/560-large_default/sejuta-surat-cinta.jpg,https://tokoalvabet.com/194-large_default/sejuta-surat-cinta.jpg
Sekolah untuk Kaum Miskin,69900.0,James Tooley, Kisah Nyata,20,588," I, Februari 2013",Februari,2013,13.0,20.0,488,, 978-602-9193-67-1,"neliti sekolah-sekolah swasta di India, Profesor Tooley berkeliling ke daerah kumuh di Kota Tua Hyderabad. Terkejut menemukan daerah itu dipenuhi sekolah-sekolah kecil, sekolah yang didanai secara mandiri oleh orangtua siswa, ia berusaha mencari tahu apakah sekolah-sekolah itu mampu menyediakan pendidikan yang berkualitas. Dari situlah dimulai petualangan menakjubkan yang terceritakan secara liris dalam buku ini.
Buku ini mengisahkan perjalanan sang Profesor dari kota kumuh terbesar di Afrika hingga daerah pedalaman Gansu di China; dari begitu banyak anak-anak, orangtua, guru, dan wirausahawan yang mengajarkan bahwa kaum miskin tidak harus menunggu sedekah pendidikan dari negara. Gaya bertutur penulis yang sangat menarik mengubah model laporan riset yang kering menjadi cerita mengalir ihwal bagaimana orangtua miskin berjuang melawan rintangan besar untuk memberikan pendidikan bermutu bagi anak-anak mereka. Buku ini menawarkan pelajaran sederhana: semangat kewirausahaan dan kasih sayang orangtua bagi anak-anaknya.
-
-
Tentang Penulis
James Tooley adalah profesor bidang kebijakan pendidikan di Newcastle University, Inggris. Profesor Tooley meraih gelar PhD dari Institute of Education, University of London, sedangkan gelar MSc ia sandang dari University of Sussex setelah sebelumnya ia memperoleh gelar BSc bidang Matematika juga dari University of Sussex.
Pria kelahiran Inggris pada Juli 1959 ini memulai kariernya sebagai guru Matematika di Zimbabwe (1993-1996). Pada 1998, ia pindah ke National Foundation for Educational Research di Inggris. Setelah menyelesaikan pendidikan doktoralnya, ia sempat bekerja sebentar di Simon Fraser University, Kanada, dan University of the Western Cape, Afrika Selatan. Studi post-doktoral pertamanya ia jalani di Departemen Kajian Pendidikan, University of Oxford, di bawah bimbingan Profesor Richard Pring. Dari Oxford, ia kemudian hijrah ke University of Manchester pada 1995. Dan, sejak Juli 1998 hingga sekarang, ia mengabdi di Newcastle University.
Selama 2007-2009, ia menjabat Presiden The Education Fund, Orient Global. Belakangan ini, ia menjadi ketua perusahaan pendidikan di Ghana (Omega Schools Franchise Ltd) dan India (Empathy Learning Systems Pvt Ltd), lembaga-lembaga yang menciptakan sekolah swasta berbiaya rendah.
Sejumlah buku telah ia tulis, sedangkan karya-karyanya berupa artikel terpublikasikan di berbagai media massa ternama seperti Newsweek, Atlantic, Wall Street Journal, dan Financial Times. Berkat penelitiannya tentang sekolah swasta untuk kaum miskin di India, China, dan Afrika, ia dianugerahi medali emas oleh International Finance Corporation/Financial Times Private Sector Development Competition pada September 2006.
Profesor Tooley kini membagi waktunya untuk dua tempat: Hyderabad, India, dan Beijing, China, tempat dia bekerja bersama para wirausahawan dan guru yang menginspirasi buku ini.",,https://tokoalvabet.com/39-large_default/sekolah-untuk-kaum-miskin.jpg,https://tokoalvabet.com/475-large_default/sekolah-untuk-kaum-miskin.jpg
Selera Desa,24900.0,James Tooley, Kisah Nyata,1,588,,Februari,2013,13.0,20.0,488,, 978-602-9193-67-1,"Masakan kampung menjadi hidangan pilihan banyak orang. Rasanya yang enak dan unik membuat kita sukar melupakannya. Bahan-bahannya pun mudah diperoleh di kawasan sekitar kampung. Contohnya ikan sepat, ikan puyu, pakis, daun mangis, dan sebagainya. Memang, terkadang agak susah mencari bahan seperti ini. Tetapi, tak usah khawatir, pergi saja ke pasar tradisional, pasti ada bahan yang diinginkan.

Uniknya dari masakan kampung ini, jika sudah makan sekali pasti akan merasa ketagihan. Apa saja yang dihidangkan pasti menambah selera, biarpun kelihatannya tidak mewah. Dan akan terasa tidak lengkap hidangan bila tidak ada sambal terasi beserta lalapannya.

Menu-menu yang disajikan bukan saja sedap tetapi juga berkhasiat. Parisa menyediakan menu Selera Desa buat Anda.

Selamat mencoba!",,https://tokoalvabet.com/341-large_default/selera-desa.jpg,
Self-Help,110000.0,Samuel Smiles, Pengembangan Diri,50,612," I, November 2020",November,2020,13.0,20.0,512,, 978-623-7162-66-7,"Self-Help adalah buku klasik yang terbit pertama kali pada 1859 dan langsung menjadi bestseller. Terjual 20.000 eksemplar dalam satu tahun setelah penerbitan dan saat kematian penulisnyapada 1904telah terjual lebih dari seperempat juta eksemplar. Sampai saat ini, buku ini masih sangat relevan dan terus diterbitkan guna menginspirasi Anda pada potensi diri sendiri dan menanamkan keinginan untuk sukses.
Buku ini adalah pendahulu dari literatur motivasi dan karya-karya pengembangan diri saat ini. Berisi pelajaran yang kuno tetapi bermanfaat, tentang konsep-konsep yang masuk akal seperti pentingnya belajar dari kegagalan, pengalaman adalah guru terbaik, dan nilai penghematan, kerendahan hati, serta kejujuran. Semua dibumbui dengan biografi mulia dari kehidupan orang-orang yang mampu mengembangkan potensi diri mereka untuk meraih impian.","Samuel Smiles (23 Desember 1812-16 April 1904) adalah seorang penulis Skotlandia dan pembaharu pemerintahan. Ia lahir di Haddington, East Lothian, Skotlandia. Ayahnya meninggal dalam wabah kolera tahun 1832. Berkat dukungan dari ibunya, Smiles dapat tetap melanjutkan pendidikannya. Ia belajar kedokteran di Universitas Edinburgh pada 1829.
Karya-karyanya antara lain: Self-Help (yang diterbitkan oleh Gemilang [Kelompok Pustaka Alvabet] dengan judul yang sama), melalui karya inilah Smiles menginspirasi banyak orang, termasuk Orison Swett Marden, penulis inspirasional Amerika, yang mengaku telah membaca Self-Help selama masa mudanya dan telah menginspirasi kehidupan serta karya-karyanya. Karya Smiles yang lain yaitu: Character (1871), Thrift (1875), Duty (1880), dan Life and Labour (1887).",https://tokoalvabet.com/598-large_default/self-help.jpg,https://tokoalvabet.com/383-large_default/self-help.jpg
Senjata Hebat Para Introver,75000.0,Holley Gerth, Pengembangan Diri,50,404," I, Mei 2022",Mei,2022,13.0,20.0,304,, 978-623-7162-93-3,"Apakah Anda sering membandingkan diri Anda dengan orang lain? Berpikir bahwa orang lain mudah bergaul namun Anda tidak. Dan ketakutan terkadang menguasai diri Anda. Holley Gerth pernah mengalaminya, karena dia seorang introver. Begitu juga orang-orang hebat lainnya seperti: Joanna Gaines, Abraham Lincoln, Albert Einstein, Oprah, dan Michael Jordan.
Gerth menunjukkan bahwa apa yang seorang introver lihat sebagai perjuangan sebenarnya bisa menjadi kekuatan terbesar mereka! Alih-alih bertanya, untuk sukses haruskah Anda berubah. Ia menunjukkan bahwa Anda bisa kuat dengan sepenuhnya menjadi diri Anda sendiri. Biarkan Senjata Hebata Para Introver menunjukkan bahwa Anda persis seperti yang Tuhan ciptakan untuk Anda!
Dalam buku yang membuka mata ini, Holley Gerth membagikan semua yang perlu Anda ketahui, mulai dari ilmu otak hingga aspek psikologis, sosial, dan spiritual menjadi seorang introver. Ia juga mengungkapkan dengan tepat apa yang akan membantu Anda memenangkan perjuangan. Dan, memaksimalkan kekuatan Anda sehingga Anda dapat hidup dengan kejelasan, keberanian, dan penuh kepercayaan diri di dunia yang membutuhkan apa yang hanya dapat Anda berikan! 
***
“Gambaran pribadi, kisah seorang introver terkenal, dan pandangan menarik tentang ilmu saraf. Buku ini sangat berharga.
―Shaunti Feldhahn, peneliti sosial dan penulis buku bestseller
“Holley Gerth adalah pemandu yang sangat bijaksana dan tepercaya tentang apa artinya hidup sebagai seorang introver. Praktis dan sangat membantu.”
―Ann Voskamp, penulis bestseller New York Times","Holley Gerth merupakan penulis buku bestseller Wall Street Journal untuk bukunya yang berjudul You’re Already Amazing dan beberapa buku lain. Dia juga memiliki gelar doktor di bidang konseling, merupakan salah satu pemandu Podcast More than Small Talk, dan life coach bersertifikat.
Holley menikah dengan Mark, kekasihnya semasa kuliah, lebih 20 tahun lalu. Bersama mereka menjadi orangtua dari Lovelle dan kakek-nenek dari Eula.    Lovelle berumur 21 tahun ketika Eula hadir dalam kehidupan mereka, dan Tuhan masih terus menulis kisah keluarga mereka dengan cara-cara yang tidak terduga.
Anda bisa menemukan Holley di meja di sudut sebuah kedai kopi dengan secangkir latte susu almond, seorang teman, dan laptop kesayangan, sedang menulis buku berikutnya. 
Hubungilah Holley dan dapatkan lebih banyak sumber- bermanfaat untuk introver di holleygerth.com/introverts.",https://tokoalvabet.com/737-large_default/senjata-hebat-para-introver.jpg,https://tokoalvabet.com/736-large_default/senjata-hebat-para-introver.jpg
