Judul,Harga,Penulis,Genre,Stock,Berat,Cetakan,Bulan,Tahun,Lebar,Panjang,Tebal,Format,ISBN,Sinopsis,Tentang_penulis,Foto Produk1,Foto Produk2
Managing Human Capital in Indonesia (Best Practices in Aligning People with Strategic Goal),197000.0,"Naresh Makhijani, James Creelman, and Krishnan Rajendran", Manajemen SDM,50,296," I, Mei 2009",Mei,2009,16.0,24.0,196,, 978-979-18673-2-0,"Indonesian organizations are facing ever increasing competitive pressure within and between local companies but also from global competitors. Consequently, to defend local markets and indeed exploit growth opportunities in other regions, the management of human capital (the skills, competencies and mindsets of the employeebase) has become a performance imperative for lndonesian organizations.

Managing Human Capital in Indonesia: Best Practices in Aligning People with Strategic Goals explains how lndonesian organizations can migrate the management of human capital from a tactical, personnel operation to a strategic capability. In the first instance this requires a substantive overhaul of the human resource function. Based on an analysis of Indonesian, Asian and global best practices in HR management, this book explains how HR functions are being reconfigured as Strategic HR functions.

The book's step-by-step practical guidelines shows how HR professionals can gain a firm understanding of the strategic imperatives of the enterprise and use this knowledge to deploy effective HR interventions. Central to such interventions is the providing of strategically critical people goals, measures and targets within a corporate Balanced Scorecard. From this, the HR organization should then build its own dedicated HR scorecard that ensures that the work of all in the function is strategically focused.

Using the Balanced Scorecard as an overarching strategy management framework. Managing Human Capital in Indonesia: Best Practices in Aligning People with Strategic Goals helps the reader master those HR interventions that are most critical to the success of the enterprise.

The book describes how to build and deploy a robust process for identifying, nurturing and retaining talent–a urning platform for organizations across the globe–and how to implement best practice competency, training and coaching frameworks. Providing both a helicopter view of improving enterprise performance as well as coming on developing that of the individual, the book shows how to ensure that people capabilities are hardwired to strategic goals through the shaping of individual Balanced Scorecards–from executive to front-line levels–that serve as the only appraisal system and that drive the application of appropriate bonus systems.

The book also describes how lndonesian organizations can create a cadre of leaders that are capable of leading global enterprises and explains how to build a highperforming corporate culture.

Reporting the findings of an exclusive survey of the HR practices of Indonesia-based organizations that was commissioned to support this book, Managing Human Capital in Indonesia: Best Practices in Aligning People with Strategic Goals provides a clear roadmap for readers to follow in the creation of a high-performing HR organization: a function that is seen as a strategic asset of the enterprise.",,https://tokoalvabet.com/313-large_default/managing-human-capital-in-indonesia.jpg,
Manajemen Konflik Berbasis Sekolah,52500.0,"Rizal Panggabean, dkk.", Pendidikan,20,312," I, Mei 2015",Mei,2015,15.0,23.0,212,, 978-979-18673-2-0,"dimungkiri, konflik bisa muncul di mana saja termasuk di lingkungan sekolah. Konflik bisa terjadi karena urusan pribadi maupun urusan bersama, antar-individu atau antar-kelompok, antara guru dan siswa, guru dan kepala sekolah, bahkan antara para guru dan manajemen sekolah. Lantas bagaimana semua ini seharusnya diatasi?
 
Penanganan konflik adalah dengan mengelolanya secara benar, bukan menghilangkannya sama sekali. Mengapa konflik perlu dikelola secara benar, siapa yang melakukannya, dan bagaimana caranya? Buku Manajemen Konflik Berbasis Sekolah ini memaparkannya dengan lugas dan bernas. Pembaca akan diajak memahami apa itu konflik dan manajemen konflik, bagaimana melakukan penaksiran konflik, sampai hal-hal praktis seperti bagaimana membina kelas dan sekolah yang damai, melakukan mediasi sejawat, bahkan mengatasi perundungan (bullying) yang kerap terjadi di lingkungan sekolah.
 
Pengelolaan konflik secara benar di sekolah tidak saja akan menghasilkan lingkungan yang kondusif untuk kegiatan belajar-mengajar, tetapi juga mendewasakan setiap individu untuk dapat menerima perbedaan sebagai rahmat dan pembelajaran, bukan masalah dan sumber pertentangan.
 
***
 
“... Buku MKBS ini merupakan respons langsung Sekolah Sukma Bangsa terhadap kondisi kekerasan di Aceh, terutama di lingkungan pendidikan, pasca-gempa, tsunami dan konflik.”
 
—Prof. Dr. Komaruddin Hidayat, M.A., Guru Besar UIN Syarif Hidayatullah Jakarta
 
“Buku ini berisi pengalaman yang sangat berharga dari para praktisi pendidikan. Perlu dibaca oleh para guru, para pengambil kebijakan pendidikan, bahkan bagi para peneliti.”
 
—Prof. Dr. H.A.R. Tilaar, M.Sc.Ed., pakar pendidikan",,https://tokoalvabet.com/541-large_default/manajemen-konflik-berbasis-sekolah.jpg,https://tokoalvabet.com/154-large_default/manajemen-konflik-berbasis-sekolah.jpg
Manajemen Sekolah Efektif,110000.0,"Ahmad Baedowi, dkk.", Pendidikan,19,618," I, Mei 2015",Mei,2015,15.0,23.0,518,, 978-979-18673-2-0,"Sekolah Sukma Bangsa (SSB) yang dibangun untuk anak-anak korban bencana tsunami 2004 di Aceh merupakan salah satu wujud sumbangsih anak bangsa untuk saudara-saudara mereka yang terkena bencana. Dengan visi dan misi yang jelas dan terukur sedari awal, Sekolah Sukma Bangsa tumbuh menjadi sekolah bermutu yang perlahan namun pasti menjelma menjadi sekolah yang membentuk sikap-budaya nilai-nilai luhur.


 
Buku Manajemen Sekolah Efektif ini merangkum bukan saja konsep-konsep dan teori dalam mengelola sekolah secara efektif, tetapi juga beragam pengalaman terbaik (best practice) Sekolah Sukma Bangsa dalam melaksanakannya. Sederet hal penting dibahas di sini, mulai dari strategi menciptakan visi, misi dan budaya sekolah, membangun sistem dan tim kerja, supervisi sekolah, hingga evaluasi manajemen dalam pengelolaan sekolah yang efektif. Cuplikan-cuplikan kisah pengalaman Sekolah Sukma Bangsa dan berbagai contoh formulir  atau proposal serta dokumen penting statuta sekolah yang dilampirkan di bagian akhir membuat buku ini menjadi penting bagi siapa saja yang peduli pada mutu pendidikan secara umum di negeri ini.","Ahmad Baedowi lahir di Bekasi pada 10 Oktober 1964. Sarjana dari Jurusan Perbandingan Agama, Fakultas Ushuluddin, IAIN Sunan Kalijaga Yogyakarta (1990) ini menyelesaikan program Master of Education (M.Ed) pada School of Leadership Education, George Mason University, Virginia, Amerika Serikat, pada 2003. Sejak 2008 ia juga menjadi penanggung jawab rubrik pendidikan pada harian nasional Media Indonesia. Kolomnya, Calak Edu, setiap hari Senin di media tersebut menggambarkan betapa ia sangat concern terhadap dunia pendidikan.


 

 
Pria yang sejak 2006 menjabat Direktur Pendidikan Yayasan Sukma, Media Group, Jakarta, ini terlibat pula dalam beberapa riset tentang radikalisme di lingkungan guru agama dan siswa sekolah menengah umum bersama Lembaga Kajian Islam dan Perdamaian (LaKIP), Indonesian Institute for Society Empowerment (INSEP), dan Yayasan Paramadina, Jakarta. Selain menjadi Dewan Redaksi Penerbit Pustaka Alvabet sejak 2004, ia juga tergabung dalam Institute for Peace and Islamic Studies, Jakarta sejak 2010. Di sela berbagai kesibukannya, ia menyempatkan diri mengajar mata kuliah Manajemen Kurikulum dan Efektivitas Manajemen Sekolah pada Fakultas Tarbiyah dan Ilmu Keguruan, UIN Syarif Hidayatullah, Jakarta.",https://tokoalvabet.com/477-large_default/manajemen-sekolah-efektif.jpg,https://tokoalvabet.com/43-large_default/manajemen-sekolah-efektif.jpg
Manajemen Sengketa Partai Politik,98000.0,"Prof. Yasonna H. Laoly, SH., MSc., Ph.D.", Hukum/Politik,50,476," I, September 2019",September,2019,14.0,21.0,376,, 978-602-6577-45-0,"Bung Karno, dalam sebuah bukunya pernah menulis, “Partailah yang memegang obor, partailah yang berjalan di muka, partailah yang menyuluhi jalan yang gelap dan penuh dengan ranjau-ranjau sehingga menjadi jalan terang.” Bagi Bung Karno, di alam demokrasi, partai politik ibarat lentera di tengah kegelapan malam. Tak bakal tentu arah demokrasi tanpa kehadiran partai politik. Namun sayang, di Indonesia, idealitas partai politik yang dibayangkan Bung Karno, bahkan hingga kini, belum sepenuhnya terwujud. Alih-alih menjadi penyuluh, partai politik justru kerap kehilangan arah bagi dirinya sendiri.

Buku ini membeberkan perihal dinamika partai politik di Indonesia. Terutama terkait sengketa antarkader di internal parpol. Perpecahan yang berlarut, nyaris tak ada ujung. Di situlah kemudian dibutuhkan peran pemerintah, dalam hal ini Kementerian Hukum dan HAM, sebagai juru damai, guna menyatukan kembali perahu partai yang terbelah. Peran ini, tentu, bukan sebagai bentuk intervensi, tapi sebuah kesadaran penuh penuh bahwa partai politik di Indonesia harus kembali pada spirit awal, sebagai pilar utama demokrasi.

Maka itu, perlu Manajemen Sengketa Partai Politik. Dan Kementerian Hukum dan HAM, di bawah komando Yasonna H. Laoly, berhasil memerankan itu secara apik dan elegan.","Prof. Yasonna Hamonangan Laoly, SH., MSc., Ph.D. lahir di Sorkam, Tapanuli Tengah, pada 27 Mei 1953. Ia adalah Menteri Hukum dan Hak Asasi Manusia dalam Kabinet Kerja yang menjabat sejak 27 Oktober 2014.

Yasonna memulai pendidikan dasar di SR Katolik Sibolga pada 1959. Enam tahun kemudian, usai tamat dari SR tahun 1965, ia melanjutkan ke SMP Negeri 1 Sibolga dan lulus tahun 1968. Di kota yang sama, Yasonna menghabiskan masa-masa SMA. Ia masuk ke SMA Katolik Sibolga pada 1968, dan lulus pada 1971.

Cita-citanya yang tinggi membawanya pergi jauh dari rumah. Ia merantau ke Medan, belajar ilmu hukum di Fakultas Hukum Universitas Sumatera Utara (USU), Medan, lulus tahun 1978. Lima tahun kemudian, mulai tahun 1983 hingga 1984, ia mengikuti  Internship in Higher Education Administration Roanoke Collegedi Salem Virginia, Amerika Serikat. Dilanjutkan dengan kuliah strata dua di Virginia Commonwealth University. Tahun 1986, Yasonna berhasil menyandang gelar Master of Science (MSc.) di usia 33 tahun.

Dahaga ilmu tak membuatnya berhenti belajar. Di Negeri Paman Sam pula, ia meneruskan pendidikan strata tiganya di North Carolina State University, Amerika Serikat. Pada 1994, tepat di usia 41 tahun, Yasonna memperoleh gelar Ph.D. dari universitas tersebut.

Kurang lebih 8 tahun kuliah di Amerika, banyak prestasi yang Yasonna torehkan. Ia menjadi salah satu mahasiswa Indonesia yang cemerlang, dan mampu bersaing dengan para mahasiswa dari banyak negara lain di dunia. Yasonna mendapatkan penghargaan Outstanding Graduate Student Award Virginia Commonwealth University pada 1986, mendapatkan penghargaan Alpha Kappa Delta International Sociology Honor Society tahun 1987, dan Sigma Iota International Honor Society tahun 1993.

Puncak akademik ia peroleh di tahun 2019. Melalui SK Menristekdikti RI Nomor 25458/M/KP/2019, terhitung sejak 1 Juni 2019, Yasonna diangkat menjadi Guru Besar dengan jabatan Profesor dalam Bidang Kriminologi pada Sekolah Tinggi Ilmu Kepolisian, Jakarta.

Yasonna mulai bekerja sebagai Pengacara & Penasihat Hukum tahun 1978-­1983, kemudian menjadi Pembantu Dekan Fakultas Hukum Universitas HKBP Nommensen pada kurun 1980­-1983. Lalu sebagai Dekan Fakultas Hukum Universitas HKBP Nommensen (1997-­1999) dan peneliti di North Carolina State University pada 1992­1994, serta asisten dosen (teaching assistance) mata kuliah Sociology of Law di almamaternya tersebut. Dan sejak tahun 2000 hingga saat ini, ia masih menjadi dosen.

Selain di dunia akademik, Yasonna juga aktif dalam berbagai organisasi sejak di BPC GMKI Medan pada 1976 dan Waka Bendahara KNPI Medan pada 1983. Ia juga pernah menjabat sebagai Sekretaris BKS PGI­GMKI Sumut­Aceh dan Ketua BKS PGI­GMKI Pusat periode 2009­-2014, Ketua Umum Mahasiswa Nias. Ia terlibat dalam kepengurusan PDI Perjuangan Sumatera Utara untuk rentang waktu 2000-­2008.

Pada 2002-­2005, Yasonna dipercaya sebagai Kepala Badiklatda PDI Perjuangan Sumut (2002­-2005) dan Wakil Ketua DPD PDI Perjuangan Sumut (2000-­2005). Kemudian ia menjadi Anggota DPRD Sumut periode 1999­2004. Pada periode berikutnya, yakni 2004-­2009, Yasonna terpilih menjadi Anggota DPR RI mewakili PDI Perjuangan. Di DPR RI tersebut, ia duduk sebagai Anggota Komisi III dan tergabung di Badan Legislasi. Sedangkan pada periode 2009­-2014, Yasonna dipercaya menjadi Anggota Komisi II dan Wakil Ketua Badan Anggaran DPR RI. Sementara itu, di MPR RI, ia menjadi Ketua Fraksi PDI Perjuangan.

Yasonna H. Laoly adalah putra dari seorang purnawirawan perwira POLRI, Faogὀ’aro Laoly, dan R. br Sihite. Yasonna menikah dengan Elisye Widya Ketaren dan dikaruniai empat orang anak, yakni: Novrida Lisa Isabella Laoly, Fransisca Putri Askari Laoly, Yamitema Tirtajaya Laoly, dan Jonathan Romy Laoly. Juga menantu: Julius Wijaya Silitonga (suami dari anak pertama), Stevi Kristofer Wospakrik (suami anak kedua); dan cucu­-cucu: Nadya Aureli Jessica, Jacob Nathanniel Pardomuan (dari anak pertama), Hanna Angelia, Nathaniel Christiansen, dan Jeremy Vincent (dari anak kedua).",https://tokoalvabet.com/109-large_default/manajemen-sengketa-partai-politik.jpg,
Masa Depan Dunia Setelah Covid-19,49000.0,Jason Schenker, Sosial/Ekonomi,42,316," I, Juli 2020",Juli,2020,13.0,20.0,216,, 978-623-220-085-2,"Pandemi Covid-19 berdampak sangat luas dalam kehidupan, bahkan belum pernah dirasakan umat manusia pada bisnis, ekonomi, dan masyarakat. Dampak tersebut kemungkinan akan membayangi—dalam cara yang buruk dan baik—pada tahun-tahun dan dekade mendatang. Tentu saja, ini akan berdampak pada bagaimana kita bekerja, di mana kita tinggal, dan seperti apa industri yang berbeda di masa depan.

Agar dapat beradaptasi dengan dampak tersebut, kita perlu memiliki kerangka kerja futuristik untuk menghadapi potensi perubahan jangka panjang, tantangan, dan peluang yang bakal terjadi setelah pandemi, terutama perubahan penyakit, krisis ekonomi, serta masa depan pekerjaan, pendidikan, perawatan kesehatan, rantai pasokan dan kebiasaan konsumsi, serta dinamika lainnya.

Buku ini merupakan upaya untuk mengintegrasikan lanskap yang berubah dengan cepat karena Covid-19, dengan harapan dan strategi jangka panjang.Mengacu pada penelitian, kursus, dan materi pelatihan dari program di Futurist Institute, sebuah lembaga “peramal” masa depan yang dikomandani sang penulis, buku ini menawarkan perspektif futuristik strategis untuk menghadapi perubahan-perubahan tersebut.

 

***

 

“Buku ini padat informasi meskipun relatif tipis. Disusun dalam beberapa minggu setelah Covic-19 merebak. Luar biasa!” —Liju Jose, Amazon.com

“Jason melakukan pekerjaan yang hebat untuk menganalisis setiap elemen dan melangkah lebih jauh untuk membuat Anda berpikir tentang efek riak Covid-19.” —Jason Davis, Amazon.com","Mr. Schenker adalah Presiden Prestige Economics and Ketua of The Futurist Institute. Dia dinobatkan sebagai salah satu dari peramal dan futuris finansial paling akurat di dunia. Bloomberg News menempatkan Mr. Schenker di puncak peramal dalam 43 kategori, termasuk nomor 1 di dunia untuk akurasinya dalam 25 kategori, termasuk meramalkan Euro, Pound Inggris, Ruble Rusa, RMB China, harga minyak mentah, harga gas alam, harga emas, harga logam industri, harga komoditas pertanian, dan lapangan kerja Amerika Serikat.

Mr. Schenker masuk sebagai salah satu dari 100 penasihat finansial paling berpengaruh di dunia oleh Investopedia pada tahun 2018. Karyanya diulas di Wall Street Journal, The New York Times, dan Frankfurter Allgemeine Zeitung. Dia muncul di CNBC, CNN, ABC, NBC, MSNBC, Fox, Fox Business, BNN, Bloomberg Jerman, dan BBC. Mr. Schenker menjadi pembawa acara tamu untuk Bloomberg Televison dan menjadi kolumnis untuk Bloomberg Opinion.",https://tokoalvabet.com/568-large_default/masa-depan-dunia-setelah-covid-19.jpg,https://tokoalvabet.com/212-large_default/masa-depan-dunia-setelah-covid-19.jpg
Mata Air Hakikat,65000.0,Syaikh Dawud bin Makhilla, Motivasi Islam,49,404," I, Maret 2020",Maret,2020,13.0,20.0,304,, 978-623-7163-29-9,"Di tengah kehidupan yang serbacepat dan serbainstan tanpa jeda dan pendalaman, kita sering lupa diri sendiri. Akibatnya, kita mudah hanyut terbawa bahkan terseret arus tanpa pegangan, masuk dalam dunia yang hiruk-pikuk dan riuh tanpa makna dan tujuan. Hati dan jiwa kita pun menjadi keras dan sakit, terlepas dari sesuatu yang substantif dan penting dalam diri kita, yakni kedekatan dan keintiman dengan Allah. Dua hal yang sesungguhnya membuat kita selalu mendapat bimbingan serta curahan cinta dan kasih sayang-Nya.


Buku klasik karya ulama besar dan ahli hakikat, serta sahabat dekat sufi agung Ibnu ‘Athaillah as-Sakandari, ini berisi petuah-petuah bijak sarat gizi spiritual dan hikmah bak mata air yang melembutkan hati dan membangun jiwa untuk meraih cinta Allah. Buku ini menembus dan menyibak tirai yang menutupi hati kita akibat keras, sakit dan jauhnya ia dari Allah. Petuah-petuah di buku ini menuntun kita kembali meniti jalan spiritual yang lurus, membuat hati dan jiwa kita kembali lembut, tenang dan terang, yang berimbas positif pada perilaku dan sikap kita dalam kehidupan.


***


“Buku ini berisi kata-kata penuh hikmah tentang pokok-pokok tazkiyah (penyucian) dan tahalliyah (penghiasan) hati, tarqiyah (peningkatan) kualitas ruhani, serta musyahadah (penyaksian) dengan cahaya rabbani. Kita akan ditunjukkan tentang hakikat mahabbah (cinta), keikhlasan, kejujuran, keimanan, dan keyakinan, serta rahasia-rahasia ibadah yang Allah perintahkan kepada kita melalui lisan Nabi-Nya.” —Prof. Dr. ‘Ashim Ibrahim al-Kayyali al-Husaini, Syaikh Tarekat asy-Syadziliyah ad-Darqawiyah, Libanon","Syaikh Dawud bin Makhilla. Lengkapnya, Syarafuddin Abu Sulaiman Dawud (al-Kabir) bin ‘Umar bin Makhilla al-Kahari as-Sakandari. Salah seorang wali besar dan sufi terkenal serta pengikut tarekat asy-Syadziliyah di Alexandria, Mesir. Ia bersahabat dekat dengan Tajuddin Ahmad bin ‘Athaillah as-Sakandari dan ahli makrifat Syaikh Muhammad Wafa asy-Syadzili. Sebelumnya, ia bekerja sebagai petugas keamanan di rumah seorang gubernur di Alexandria. Ia wafat pada 732 H/1331 M. Di antara karyanya, Kasyf al-Balâghah, ar-Risâlah al-Mardhiyah fi Syarh Duâ’ asy-Syadziliyah, dan ‘Uyûn al-Haqâ’iq (edisi terjemahan Indonesianya diterbitkan oleh Alifia Books-Pustaka Alvabet, 2020).",https://tokoalvabet.com/522-large_default/mata-air-hakikat.jpg,https://tokoalvabet.com/129-large_default/mata-air-hakikat.jpg
Maysuri,59000.0,Nadjib Kartapati Z., Novel,18,416," I, Maret 2016",Maret,2016,13.0,20.0,316,, 978-623-7163-29-9,"nak seorang pelacur merupakan aib besar yang memalukan. Harga diri seakan hancur, menjadi bahan bully dan cemoohan, dan semua orang bisa menjauh. Padahal, dosa orangtua tak bertemurun kepada anaknya, apalagi jika sang anak lahir bukan dari hasil melacur.

Inilah kisah Maysuri, perempuan religius beribu pelacur. Sejak usia tujuh bulan, ia hanya diasuh ayahnya, seorang guru bergaji pas-pasan yang menikah lagi di kemudian hari. Sang ayah mengusir ibunya, lantaran sang ibu menjadi pelacur—demi tuntutan ekonomi. Setelah Maysuri dewasa, sebuah pertemuan tak terduga dengan ibu kandungnya menguak masa lalu keluarga yang selama ini ia tak ketahui. Tetapi, Maysuri tak marah pada ibunya. Sebaliknya, dengan penuh ketaatan dan kecintaan, ia gigih “mengangkat” ibu kangdungnya dari dunia hitam.

Novel ini menyuguhkan banyak cerita memukau: tentang keretakan dan konflik keluarga, keberbaktian seorang anak, kekukuhan memegang prinsip; ihwal cinta dan kesetiaan, religiusitas, dan titik balik kehidupan. Dengan plot mengalir dan enak dibaca yang sarat pesan moral dan inspirasi, Nadjib membawa kita masuk ke dalam cerita yang sangat dekat dengan kehidupan nyata.

***

“Pada hakikatnya, Nadjib Kartapati bukanlah mengarang novel. Ia tidak menciptakan karya sastra: ia menyedekahkan sebagian kecil dari keindahan hidupnya kepada kita. Tidak ada ‘tokoh’ Nadjib dalam karyanya, karena sudah penuh oleh jiwanya.”

—Emha Ainun Nadjib, Penyair dan Budayawan",,https://tokoalvabet.com/543-large_default/maysuri.jpg,https://tokoalvabet.com/156-large_default/maysuri.jpg
Makkah wa al-Madinah fi al-Jahiliyah wa ‘Ahd ar-Rasul,189000.0,Dr. Ahmad Ibrahim asy-Syarif, Sejarah,50,732," I, 2021",,2021,15.0,23.0,632,, 978-623-220-119-4,"Mekkah dan Madinah, dua kota suci dan mulia umat Islam, memiliki sejarah panjang yang belum banyak terkuak, terutama pada era sebelum Islam atau zaman jahiliah. Kebanyakan buku-buku tarikh dan sirah Nabi Muhammad lebih fokus kepada sosok dan ketokohan beliau, dari sejak lahir hingga wafat serta dakwahnya yang sangat sukses berikut berbagai keajaiban atau mukjizat yang mengikutinya. Tidak banyak yang melihat dengan cermat aspek-aspek latar belakang, konteks, atau kondisi sosial, politik, ekonomi, dan budaya pada saat itu, terutama di Mekkah dan Madinah.
Didasarkan pada sumber-sumber autentik, valid, otoritatif, dan dapat dipertanggungjawabkan secara ilmiah, buku ini mengungkap secara detail dan komprehensif aspek-aspek tersebut dari era jahiliah hingga Islam. Sumber-sumber itu tak hanya dari para sejarawan dan penyair Arab, tetapi yang paling penting dan paling autenik—menurut penulis buku ini—adalah ayat-ayat al-Quran dan riwayat sahih. Banyak sekali riwayat dan informasi (khabar) yang tidak sahih dan kontradiktif, sehingga malah membuat sejarah Mekkah dan Madinah jadi kabur.  
Buku yang kaya dengan rujukan ilmiah dan narasi yang mengalir enak ini membantu kita memahami secara lebih baik sejarah Islam dan Nabi Muhammad sejak awal dan dua kota suci tersebut. Menarik disimak.         
***
“Buku yang bagus, menyajikan sejarah Mekkah dan Madinah berdasarkan al-Quran, riwayat, buku-buku klasik, syair, dan buku-buku mutakhir. Referensinya sangat banyak, dan membuat Anda mempercayai penelitian ini.” —Goodreads","Ahmad Ibrahim asy-Syarif. Doktor dan pengajar sejarah Islam di sejumlah perguruan tinggi di Timur Tengah, di antaranya Universitas ‘Ain asy-Syams, Mesir, dan Universitas al-Kuwait, Kuwait. Telah menulis banyak buku bertema sejarah Islam, di antaranya al-‘Alam al-Islȃmi fi al-‘Ashr al-‘Abbasi, ad-Daulah al-Islȃmiyah al-Ula, Dirȃsat fi al-Hadhȃrah al-Islȃmiyah, Daur al-Hijaz fi al-Hayȃh as-Siyȃsiyah al-‘Ammah, dan Daulah ar-Rasȗl fi al-Madinah.",https://tokoalvabet.com/700-large_default/mekkah-dan-madinah-hard-cover.jpg,https://tokoalvabet.com/701-large_default/mekkah-dan-madinah-hard-cover.jpg
Mencari Nouf,67500.0,Zoe Ferraris, Novel,49,580," I, Juli 2014",Juli,2014,13.0,20.0,480,, 978-623-220-119-4,"dana dari trilogy ini sungguh fenomenal. Buku laris versi San Francisco Chronicle ini memenangi Los Angeles Times Award kategori Debut Fiksi. Karya ini pun terpilih sebagai Best New Voices of the Year oleh Waterstone’s Booksellers. Majalah The Independent bahkan menetapkannya sebagai satu dari 10 Novel Terbaik Musim Semi. Dan, Barnes & Noble memasukkannya pula ke dalam daftar Penemuan Penulis Baru Terbaik.
Kisahnya bertutur ihwal Nouf, putri dari keluarga lokal terpandang, yang raib misterius. Di gurun pasir yang panas di Arab Saudi, sebuah regu pencari dikirim untuk menemukannya. Seorang pemandu wisata gurun, Nayir Syarqi, disewa guna memimpin pencarian. Untuk mengungkap misteri Nouf, Nayir bekerja sama dengan Katya Hijazi, seorang wanita merdeka tunangan saudara Nouf. Dengan segera, dimulailah cerita menegangkan yang menawarkan pengetahuan langka perihal suatu negeri di mana kaum wanita wajib berpenutup muka di ruang publik; dimana kepercayaan kuno, tabu, dan adat-istiadat seringkali berbenturan dengan dunia modern.
Inilah novel detektif yang menyingkap selubung rahasia ihwal negeri kaum pendoa yang puritan dan patriarkis. Ber-setting dunia Arab modern, dengan plot yang cepat, mondar-mandir, dan sangat memikat, Mencari Nouf adalah cerita menegangkan yang memukau.
 
“Cerita detektif yang memikat, menyeimbangkan antara plot yang cepat dengan prosa yang halus.”
—San Francisco Chronicle

“Debut luar biasa! Sebuah misteri kebudayaan yang sebagian besar masih tersembunyi. Plot thriller yang digali dengan sangat memukau.”
—Entertainment Weekly",,https://tokoalvabet.com/544-large_default/mencari-nouf.jpg,https://tokoalvabet.com/158-large_default/mencari-nouf.jpg
