Judul,Harga,Penulis,Genre,Stock,Berat,Cetakan,Bulan,Tahun,Lebar,Panjang,Tebal,Format,ISBN,Sinopsis,Tentang_penulis,Foto Produk1,Foto Produk2
Gadis Roma Yang Hilang,89000.0,Donato Carrisi, Manajemen/Bisnis,40,664," I, Januari 2016",Januari,2016,13.0,20.0,564,, 978-602-9193-79-4,"Seorang gadis muda hilang secara misterius di Roma. Di kala hujan lembut turun membasahi jalan-jalan kuno di kota itu, dua orang, Clemente dan Marcus, duduk di sebuah kafe dekat Piazza Navona sembari mendalami kasus ini dengan seksama. Mereka adalah anggota Penitenzeri kuno, sebuah tim unik Italia yang terhubung dengan Vatikan dan dilatih secara khusus untuk urusan deteksi kejahatan misterius.
Mereka tak sendirian. Sandra, ahli forensik brilian dengan masa lalu yang tragis, juga bekerja pada kasus ini. Ketika satu bagian penyelidikan mempertemukan mereka, kerja brilian mereka tidak hanya menghasilkan titik terang untuk kasus gadis yang hilang, tetapi juga menyingkap tabir dunia misterius mengerikan yang tersembunyi di relung gelap kota Roma. Sebuah dunia yang begitu sempurna bagi kejahatan...
Di persembahkan oleh penulis laris dunia, inilah thriller memukau yang menawarkan jendela pengetahuan menuju dunia tersembunyi kota Roma. Sebuah karya sastra berbobot yang begitu indah menghadirkan suasana kota tua dalam halaman demi halaman, dengan plot bolak-balik yang sungguh ciamik, dan dilengkapi fakta sejarah yang mencengangkan.


***


“Ditulis oleh seorang ahli. Setiap bagiannya melompat dari satu plot ke plot lainnya, bolak-balik antara sekarang dan masa lalu. Carrisi menggunakan perangkat ini untuk membangun ketegangan yang memuncak, dan membuat akhir cerita benar-benar mengejutkan.” ―BookPage


“Fantastis… Karya Carrisi sungguh imajinatif, dengan nuansa nyata yang terasa jelas; prosanya sangat sastrawi, liris, dan sarat pengetahuan… Anda akan senang dapat turut merasakan dunia gelap yang dijelajahi, dengan eksplorasi yang menarik tentang sifat jahat manusia.” ―Mystery Scene


“Thriller memukau ini menarik pembaca ke dalam labirin yang jahat. Carrisi menulis dengan indah dan mendalam, sebuah drama psikologis yang dahsyat.” ―Kirkus Reviews


“Donato  Carrisi  menyuguhkan  hadiah  unik  yang  menggabungkan investigasi  forensik  memukau,  plot  bolak-balik  yang  mengaduk-aduk pikiran, dan karakter empatik ke dalam suatu cerita yang dahsyat.” ―Michael Koryta","Donato Carrisi lahir pada 1973. Dia belajar hukum dan kriminologi. Dia tinggal di Roma, tempatnya bekerja sebagai seorang penulis skenario televisi. Novel pertamanya, The Whisperer, merupakan buku laris internasional dan pemenang tiga penghargaan sastra di Italia dan dua di Prancis.",https://tokoalvabet.com/542-large_default/gadis-roma-yang-hilang.jpg,https://tokoalvabet.com/155-large_default/gadis-roma-yang-hilang.jpg
Geliat Islam di Negeri Non-Muslim Dunia - Sebuah Catatan Perjalanan,58000.0,"Prof. Dr. KH Nasaruddin Umar, MA", Sosial,40,372," I, Juni 2019",Juni,2019,13.0,20.0,272,, 978-623-220-041-8,"Menjadi Muslim di negara-negara yang mayoritas penduduknya non-Muslim tidaklah mudah; penuh dilema dan duka. Di satu sisi, mereka harus memegang teguh keyakinan agama terutama dalam praktik ibadah sehari-hari, di sisi lain mereka perlu menyesuaikan diri dengan ritme dan pola hidup yang berbeda di lingkungannya.

Setelah serangkaian aksi teroris di banyak tempat di dunia yang mengatasnamakan Islam, dunia Barat dilanda Islamophobia akut. Tak pelak, banyak tantangan dan masalah yang harus dihadapi warga Muslim. Tidak hanya berkaitan dengan kebijakan pemerintah setempat yang tak adil, tetapi juga dengan warga masyarakatnya yang acapkali menaruh curiga. Dengan dalih hak asasi manusia, beberapa negara memang memberikan penghormatan dan perlindungan terhadap warga Muslim. Namun, tak sedikit pula negara yang bertindak represif dan diskriminatif, setidaknya membatasi gerak-gerik mereka.

Buku ini merupakan catatan perjalanan di banyak negara di dunia. Melalui buku ini, Nasaruddin Umar menceritakan kondisi mutakhir warga Muslim di negara-negara yang dilawat: apa problem yang mereka hadapi, bagaimana memecahkannya, dan apa upaya mereka untuk tetap eksis bahkan berkembang. Buku ini juga merekam harapan warga Muslim di dunia terhadap Indonesia untuk berkontribusi lebih besar di tingkat internasional.","Prof. Dr. KH Nasaruddin Umar, MA, lahir di Ujung-Bone, Sulawesi Selatan, 23 Juni 1959.Mengawali karier sebagai dosen, kini ia menjabat sebagai Imam Besar Masjid Istiqlal, Jakarta. Beberapa jabatan struktural juga pernah diembannya, di antaranya Direktur Jenderal Bimbingan Masyarakat Islam Kementerian Agama dan Wakil Menteri Agama dari tahun 2012-2014.

Jenjang S2 ia selesaikan pada tahun 1992 di Pascasarjana IAIN (sekarang UIN) Syarif Hidayatullah, Jakarta, serta doktoral pada tahun 1998 di kampus yang sama. Selama studi kedoktorannya, ia sempat menjadi salah satu mahasiswa yang menjalani program visiting student di Universitas McGill, Montreal, Kanada (1993-1994), dan visiting student di Universitas Leiden, Belanda (1994-1995). Setelah mendapatkan gelar doktoral, ia pernah menjadi sarjana tamu di Shopia University, Tokyo (2001), sarjana tamu di Saos University of London (2001-2002), dan sarjana tamu di Georgetown University, Washington DC (2003-2004).

Dikenal luas sebagai sarjana muslim, ia juga telah banyak menerbitkan karya-karya monumental, di antaranya: Islam dan Nasionalisme Indonesia, Analisis tentang Integrasi Syari’ah Islam dalam Pembinaan Hukum Nasional (1984), Fiqh Ibadah (1987),  Tema-Tema Pokok al-Quran (1994), Antropologi Jilbab dalam Perspektif Feminis dan Penafsiran Islam (1995), Pengantar Ulumul Quran (1996), Pandangan Ali Syariati terhadap Poligami (1999), Argumentasi Kesetaraan Jender Perspektif al-Quran (1999), Kodrat Perempuan dalam Islam(1999), Rethinking Pesantren (2014), Deradikalisasi Pemahaman al-Quran dan Hadis (2014), Mendekati Tuhan dengan Kualitas Feminin (2014), Menuai Fadhilah Dunia, Menuai Berkah Akhirat (2014), Ketika Fikih Membela Perempuan (2014), Khutbah-Khutbah Imam Besar (2018), Shalat Sufistik (2019), Allah Tujuan Kita (2019).",https://tokoalvabet.com/506-large_default/geliat-islam-di-negeri-non-muslim.jpg,https://tokoalvabet.com/96-large_default/geliat-islam-di-negeri-non-muslim.jpg
Gilkey Si Pencuri Buku,59000.0,Allison Hoover Bartlett, Kisah Nyata,20,400," I, Januari 2018",Januari,2018,13.0,20.0,300,, 978-602-6577-21-4,"Apa yang sanggup kaulakukan demi cintamu pada buku?


 
Bagi John Charles Gilkey, jawabannya: masuk penjara.


 
Gilkey, si pencuri buku yang tak pernah bertobat, telah mencuri buku-buku langka dari seluruh penjuru negeri. Namun, tak seperti kebanyakan pencuri yang mencuri demi keuntungan, Gilkey mencuri demi cinta: cinta pada buku. Barangkali, sama obsesifnya dengan Gilkey adalah Ken Sanders, seseorang yang menyebut dirinya “bibliodick” (penjual buku yang merangkap sebagai detektif) dan sangat ingin menangkap si pencuri. Sanders—seumur hidup menjadi kolektor dan penjual buku langka berubah menjadi detektif amatir—tak akan berhenti memburu si pencuri yang mengacaukan perdagangannya.


 
Mengikuti kedua karakter eksentrik ini, jurnalis Allison Hoover Bartlett terjun ke dalam gairah dunia buku yang fanatis, hingga akhirnya mendapati dirinya terjebak di antara orang-orang yang tertarik menemukan harta kekayaan yang dicuri Gilkey dan seorang lelaki yang ingin tetap menyembunyikan harta kekayaan itu: sang pencuri itu sendiri. Dengan perpaduan ketegangan, wawasan, dan humor, Bartlett merangkai permainan kejar-kejaran ala kucing dan tikus menjadi narasi yang sangat memukau dan memacu adrenalin: tidak saja menunjukkan bagaimana Gilkey melakukan kejahatannya dan bagaimana Sanders akhirnya menangkapnya, tapi juga mengeksplorasi romansa buku, keinginan untuk mengoleksinya, dan godaan untuk mencurinya. Semua kolektor punya cerita tentang bagaimana mereka bisa jatuh cinta pada buku, begitu juga dengan Gilkey dan Sanders. Dan, Bartlett meletakkan cerita mereka ke dalam konteks yang lebih besar dari gairah terhadap buku, pengoleksian, dan pencurian selama berabad-abad.


 
Mengantarkan pembaca ke dalam dunia obsesi kesusastraan yang luas dan kaya, Gilkey Si Pencuri Buku menunjukkan peran besar buku dalam kehidupan kita, penghormatan yang menjadikan buku-buku itu tetap dipertahankan, dan keinginan yang membuat sebagian orang mempertaruhkan apa saja demi memiliki buku yang mereka sukai.


 
+++


 
“Buku ini mengejutkan saya. Saya membaca paragraf pertama dan langsung terserap. Narasinya memukau….” —Erik Larson, penulis laris The Devil in the White City


 
“Sebuah perjalanan menarik ke dunia obsesif yang aneh di mana kecintaan pada buku kadang-kadang bisa menjadi daya tarik yang fatal.”


 
—Simon Worrall, penulis The Poet and the Murderer


 
“Dengan detail yang amat teliti, humor jenaka, dan plot yang menggetarkan, narasi Bartlett menarik saya jauh ke dunia obsesif seorang pencuri buku dan sang pengedar buku yang akan menghentikannya. Buku ini adalah eksplorasi yang memukau tentang mengapa orang begitu mencintai buku. Jika Anda menyukai The Orchid Thief, Anda akan menyukai Gilkey Si Pencuri Buku.”


 
—Julia Flynn Siler, penulis The House of Mondavi","Allison Hoover Bartlett telah menulis dalam berbagai topik, termasuk mengenai perjalanan, seni, ilmu pengetahuan dan pendidikan, untuk New York Times, Washington Post, Salon.com, San Francisco Chronicle Magazine, San Francisco Magazine, dan media-media lainnya. Artikelnya mengenai John Gilkey dimasukkan dalam Best American Crime Reporting 2007.


 
Bartlett adalah seorang anggota pendiri kelompok menulis North 24th dan bekerja di San Francisco Writers' Grotto, sebuah studio kolektif. Bartlett menyandang B.A. dalam sastra Inggris dari UC Santa Barbara dan tinggal di San Francisco bersama suami dan kedua anaknya.",https://tokoalvabet.com/73-large_default/gilkey-si-pencuri-buku.jpg,
Guratan Pandemi,55000.0,Irwan Fecho, Kisah Nyata,37,436," I, Januari 2018",Januari,2018,13.0,20.0,336,, 9786232200869,"Pandemi, Covid-19, ini efeknya sangat dahsyat, ekonomi bisa hancur, kehidupan sosial kalang kabut, bahkan nyawa jadi taruhan. Sebab itu, pandemi ini merupakan Negara yang ancaman sangat serius, sehingga pantas kita memeranginya. Melawan musuh yang tak kasat mata.
Sebuah buku dengan judul Guratan Pandemi: Catatan dari Awal Pandemi Menuju New Normal sedikit memberikan catatan sejarah, bagaimana pemerintah mengatasi pandemi. Dimana penyelamatan ekonomi dan diri pribadi cenderung ditonjolkan, bukan masalah yang dihadapi rakyatnya.",,https://tokoalvabet.com/575-large_default/guratan-pandemi.jpg,https://tokoalvabet.com/221-large_default/guratan-pandemi.jpg
Gus Dur Menertawakan NU,27500.0,Irwan Fecho, Kisah Nyata,98,260," I, Maret 2010",Maret,2010,13.5,17.0,160,, 9786232200869,"enertawakan NU? Ah, yang bennneeer? Masa iya sih? Bukankah dia seorang kyai? Keturunan pendiri NU dan mantan Ketua Umum PB NU lagi! Nggak mungkin deh dia merendahkan “diri sendiri”!
Eiiit… jangan salah paham dulu donk! Menertawakan bukan berarti menghina loh…! Makanya jangan suka memahami kata secara harfiah! Gus Dur Menertawakan NU adalah buku kumpulan humor tentang NU, kyai dan pesantren, serta Islam dan agama. Jadi, dijamin seribu persen deh NU nggak bakal terlecehkan.
Meskipun Gus Dur—semasa hidupnya tentu saja—menjadikan organisasi kaum nahdliyin ini sebagai bahan kelakar, dia pasti tak bermaksud menghina, wong ini cuma canda alias lelucon bin guyonan kok. Nggak percaya? Tanya aja langsung si Empunya humor yang sudah almarhum! Lagi pula, kalau Gus Dur benar-benar menertawakan NU, siapa yang berani protes, hayo…! Jadi ketimbang memprotes judulnya, mendingan nikmati aja lucunya…!!!",,https://tokoalvabet.com/106-large_default/gus-dur-menertawakan-nu.jpg,
Haji Tamatu (Haji Tangi Mangan Turu),25000.0,Sukendra Martha, Humor Islam,30,206," I, September 2009",September,2009,11.5,18.0,106,, 978-979-99803-5-9,"Haji Tamatu adalah buku yang menyuguhkan wajah lain dunia haji Tanah Air. Ditulis dengan gaya humor yang cerdas, kocak, ringan, dan asyik dibaca, buku ini bagai mata air informasi yang menyegarkan dahaga carut-marut perhajian. Tidak hanya sarat banyolan dan plesetan, tapi juga kaya sindiran dan kritiktentu dengan bahasa yang tetap jenaka dan sederhana.
Didasarkan pada pengalaman pribadi penulisnya sewaktu menjalani ibadah haji ONH biasa, buku ini memuat 99 catatan lucu dan menggelitik tentang haji: dari peristilahan, pengelolaan, hingga pelaksanaan ibadah haji; dari menjelang keberangkatan para jamaah menuju Tanah Suci hingga saat mereka hendak kembali ke Tanah Air. Jika Anda kerap emosi melihat wajah perhajian Indonesia, buku ini perlu Anda baca, supaya Anda bisa tertawa!","Sukendra Martha lahir di Desa Prajawinangun (dulu Srombyong), Gegesik, Cirebon, pada 12 September 1954. Aktif menulis sejak menjadi mahasiswa Geografi UGM Yogyakarta (1973-1979). Beberapa artikelnya terkait agama dan geografi, misalnya: Peta Agama Dunia Itu: Suatu Evaluasi Kartografis, (Arena, Majalah Mahasiswa IAIN Sunan Kalijaga Yogyakarta, 1979) dan Kemungkinan Kegunaan Citra Thermal Infrared (TIR) untuk Mengenal Periodisasi Aktivitas Masjid Syuhada Yogyakarta, (Survey dan Pemetaan, Majalah Ikatan Surveyor Indonesia/ISI, 1981).
Buku yang pernah diterbitkan antara lain: Geografi Islam dan Geografiwan Muslim (LP2S Panji Wirama, Yogyakarta, 1994)kumpulan artikel yang terbit di koran mingguan Australian Muslim Times, Sydney-Australia; dan 100 Anekdot Ubudiyah (Pustaka Pesantren LKIS, 2004).
Sewaktu belajar di University of New South Wales (UNSW), Australia, dia pernah ditunjuk sebagai Vice PresidentMuslim Student Association (MSA) dan pernah aktif dalam organisasi keagamaan masyarakat Indonesia di sana: Centre for Islamic Dakwah and Education (CIDE).
Kini, suami Retno Indro Estuti dan bapak tiga anakLayung Paramesti Martha (25), Lalita Paraduhita Martha (22) dan Tawang Amuhara Martha (17)ini masih tercatat sebagai pengajar tidak tetap pada Program Studi Pendidikan Geografi FKIS, Universitas Muhammadiyah Prof. Dr. HAMKA, Jakarta. Sejak 1979, dia aktif bekerja di Badan Koordinasi Survei dan Pemetaan Nasional (BAKOSURTANAL), Cibinong, Bogor.
Pernah menjalankan ibadah umroh tahun 2003 dan ibadah haji tahun 2005 dengan ONH biasa, yang menginspirasi terbitnya buku ini.",https://tokoalvabet.com/308-large_default/haji-tamatu.jpg,
Hakikat Ibadah Menurut Ibnu ‘Arabi - Menyelami Makna dan Hikmah Rukun Islam,65000.0,Dr. Karam Amin Abu Karam, Motivasi Islam,30,388," I, Februari 2020",Februari,2020,13.0,20.0,288,, 978-623-7163-21-3,"Ibadah adalah bagian penting dalam kehidupan muslim. Ia merupakan wujud ketaatan kepada Allah sekaligus kecintaan dan usaha mendekatkan diri kepada-Nya. Namun, hal ini hanya dapat terwujud bila ibadah itu tak sekadar dipenuhi dari sisi ritual praktis, tetapi juga sisi spiritual ruhaniah. Untuk memenuhi sisi terakhir ini, ibadah perlu dihayati dan dimaknai secara lebih mendalam.

Buku ini memaparkan secara dalam dan detail makna-makna ibadah utama Islam (rukun Islam), yaitu syahadat, shalat, zakat, puasa dan haji, dari aspek tasawuf, merujuk kepada pandangan-pandangan sufistik Ibnu ‘Arabi. Tokoh besar sufi ini dikenal sebagai “Syaikh al-Akbar” (mahaguru) tasawuf dan filsafat. Karya-karya dan pemikiran-pemikirannya menjadi referensi utama dan inspirasi bagi para ahli tasawuf sesudahnya.

Tak banyak buku yang secara spesifik menggali lebih dalam makna ibadah utama Islam dari perspektif berbeda, seperti buku ini. Kita tak hanya dijelaskan secara gamblang detail-detail ibadah secara praktis, tetapi juga makna-maknanya yang lain dari yang umum kita ketahui, karena Ibnu ‘Arabi mengungkapkannya secara lebih filosofis, memadukan antara aspek naqli (dalil), ‘aqli (rasio) dan dzauqi (rasa). Menarik disimak.

***

“Ibnu ‘Arabi atau Syaikh al-Akbar (syaikh terbesar), demikian para sufi, filsuf, dan sejarawan pada masanya dan kebanyakan orang menyebutnya. Julukan ini menunjukkan kemuliaan dan popularitasnya. Tanpa disangkal dia adalah tokoh besar tasawuf falsafi, karena ilmunya yang banyak dan pemahamannya yang mendalam. Sehingga dia dikenang sepanjang masa dan menjadi objek bahasan dalam banyak studi.”","Dr. Karam Amin Abu Karam adalah pengajar tasawuf dan penahkik kitab-kitab klasik Islam. Meraih gelar doktor bidang tasawuf di Universitas Alexandria, Mesir. Buku ini, yang dalam edisi aslinya berjudul Haqîqah al-‘Ibâdah ‘inda Muhyiddîn Ibn ‘Arabi, merupakan tesisnya untuk mendapatkan gelar magister di Fakultas Adab Universitas Alexandria tahun 1989. Karyanya yang lain adalah asy-Syaikh Musthafa al-Bakri, Falsafatuh ash-Shûfiyah wa Rasâ’iluh dan ‘Âsyiq al-Makhthûthât, Qirâ’ah fi A’mâl Yusuf Zaidan at-Turâtsiyah.",https://tokoalvabet.com/521-large_default/hakikat-ibadah-menurut-ibnu-arabi.jpg,https://tokoalvabet.com/128-large_default/hakikat-ibadah-menurut-ibnu-arabi.jpg
Hidden Treasures,99000.0,Harry A. Lewis, Pengembangan Diri,60,592," I, Juli 2020",Juli,2020,13.0,20.0,492,, 978-623-7162-57-5,"Apabila seseorang sukses, dalam bisnis atau karirnya, biasanya dunia akan berkata “Dia mempunyai nasib baik.”, “Dia beruntung.” Dunia tidak melihat bagaimana dia bekerja keras selama bertahun-tahun, fokus terhadap sasarannya, dan mengerahkan setiap energi untuk mencapai sasaran itu, serta bagaimana dia mengorbankan banyak hal untuk dirinya dan kesuksesannya. Dalam kesuksesan tidak ada faktor keberuntungan. Orang muda yang berhasil adalah dia yang meninggalkan saingan-saingannya; yang menguasai bisnisnya; yang hidup dengan penghasilannya; menabung sebagian uangnya; yang mempertahankan reputasinya; yang mencurahkan waktu luangnya untuk belajar; dan menanamkan sikap yang menyenangkan sehingga mendapat jaringan.
Buku ini adalah buku klasik abadi yang membahas kehidupan orang-orang besar. Orang-orang yang tumbuh menjadi ikon-ikon sukses. Orang-orang pilihan yang sudah menapaki tangga keberhasilan, yang dimulai dari anak tangga terendah. Mereka ditelusuri kehidupannya semenjak masa kanak-kanak hingga dewasa, yang berfokus terhadap ciri-ciri karakter yang membuat mereka menjadi sangat kaya dan mampu mewujudkan impiannya.
Dalam buku ini, Anda akan menemukan jawaban mengapa sebagian orang berhasil sementara yang lain gagal, untuk dijadikan pegangan. Anda akan mendapatkan prinsip-prinsip yang mengarahkan Anda menuju kesuksesan, yang bisa dijadikan kompas untuk meraik impian Anda. Dan kepada mereka yang ingin sukses, buku ini dipersembahkan untuk Anda.",,https://tokoalvabet.com/467-large_default/hidden-treasures.jpg,https://tokoalvabet.com/52-large_default/hidden-treasures.jpg
Hidup Bahagia Tanpa Keluh Kesah,55000.0,Sirot Fajar, Motivasi Islam,50,340," I, Februari 2021",Februari,2021,13.0,20.0,240,, 978-623-7163-57-2,"Manusia senantiasa mengharapkan kehidupan yang baik, sejahtera, dan bahagia. Berbagai cara dilakukan untuk meraihnya. Namun, sering kali jalan untuk mendapatkannya terasa sulit dan berat. Dalam situasi itu, sering kali dada jadi terasa sempit, muncul perasaan putus asa dan berkeluh kesah.
Orang mukmin tak layak putus asa dan mengeluh untuk kebahagiaan yang belum dapat diraih. Al-Quran sebagai petunjuk hidup abadi telah memberikan tuntunan yang jelas dan nyata untuk mendapatkan kebahagiaan dan menghalau keluh kesah dan keputusasaan. Tuntunan itu, misalnya, dimulai dari iman atau keyakinan yang benar, bekerja efektif, gemar berbagi, tepat waktu, menjaga kepercayaan, hingga disiplin dalam ibadah. 
Buku ini tak sekadar memaparkan secara normatif tuntunan-tuntunan tersebut, tetapi juga aplikatif, berdasarkan kisah inspiratif orang-orang bahagia ketika mengamalkannya, baik dari khazanah Islam klasik maupun kekinian. Dipadukan juga dengan pandangan motivator dan ahli pengembangan diri Barat kontemporer, serta sejumlah penemuan ilmiah berkaitan dengan tuntunan di atas.","SIROT FAJAR. Sejak sekolah dasar dan menengah atas ia nyantri di pondok di Lamongan dan Kertosono, Nganjuk. Setelah itu, ia melanjutkan belajar psikologi di Universitas Negeri Surabaya. Saat ini, ia aktif di dunia dakwah dan sosial melalui IKADI (Ikatan Dai Indonesia) dan Dompet al-Quran Indonesia. Ia juga aktif mengisi seminar, pengajian, dan kegiatan lain di sekolah, kampus, masjid, dan komunitas. Selain buku ini, ia juga menulis beberapa buku, di antaranya: 30 Renungan Agar Sukses Menjalani Hidup, Psikologi Pemuda, Kisah Kasih Kekasihku, dan Generasi ABADI: Aqil Baligh Dewasa Islami.",https://tokoalvabet.com/646-large_default/hidup-bahagia-tanpa-keluh-kesah.jpg,https://tokoalvabet.com/645-large_default/hidup-bahagia-tanpa-keluh-kesah.jpg
Hidup Berjaya dan Sejahtera,75000.0,Agusman, Pengembangan Diri,50,444," I, Januari 2021",Januari,2021,13.0,20.0,344,, 978-623-7163-57-2,"Setiap orang memiliki potensi besar dan istimewa dalam dirinya yang bila dibangkitkan dapat membuatnya menjadi “sesuatu” yang hebat, luar biasa, dan mengagumkan. Namun, untuk membangkitkannya, seseorang perlu mengenalinya lebih dulu dengan baik. Keberhasilan mengenalinya akan memudahkan langkah untuk menuntun dan mengarahkannya ke jalan yang tepat, sehingga bisa mewujudkan cita-cita dan harapan besar dalam kehidupannya: hidup berjaya dan sejahtera, apa pun profesi atau aktivitas yang ditekuninya.
Buku ini menerawang benang merah kehidupan orang-orang sukses dalam beragam profesi dan aktivitas, di bidang apa pun, kemudian merangkumnya ke dalam empat jurus jitu yang menjadi kunci utama keberhasilan mereka. Jurus pertama, memperbesar mimpi, memperhebat aksi. Jurus kedua, menggali potensi, mengasah kemampuan. Jurus ketiga, menebar kontribusi, menjadi inspirasi. Jurus keempat, melakukan segala profesi dan aktivitas semata-mata karena Ilahi. 
Selain mengulas secara teoretis dari motivator papan atas dunia dan lokal, dari khazanah klasik Islam, nasihat-nasihat bijak para ulama saleh, ayat-ayat al-Quran dan hadis Nabi, penulis juga merajutnya dengan sejumlah cerita inspiratif yang menggugah dan memberi semangat kepada kita untuk menjadi apa yang kita inginkan.","AGUSMAN. Putra dari pasangan ayah H. Alwi (alm.) dan ibu Hj. Munawwarah. Lahir di Sungai Guntung, Kecamatan Kateman, Indragiri Hilir, 17 Agustus. Saat ini bermukim di daerah kelahirannya, jauh dari ibu kota Indonesia. Kegiatan sehari-hari, pagi berdinas, sore berbisnis, serta malam dan subuh menulis. Ia pernah mengenyam pendidikan di Sekolah Tinggi Ilmu Tarbiyah ar-Risalah Sungai Guntung, Kecamatan Kateman. Sejak kecil menghabiskan waktu dengan belajar. Beberapa bukunya antara lain Memeluk Indonesia dengan Sepenuh Hati (Bitread.Id, 2019) dan Menjadi Pribadi Tangguh (Checklist, 2019).",https://tokoalvabet.com/622-large_default/hidup-berjaya-dan-sejahtera.jpg,https://tokoalvabet.com/621-large_default/hidup-berjaya-dan-sejahtera.jpg
Hidup Seimbang Hidup Bahagia,35000.0,"Akhirudin DC, MA", Pengembangan Diri,20,276," I, September 2015",September,2015,13.0,20.0,176,, 978-602-71503-4-8,"Dalam menjalani kehidupan, manusia membutuhkan keseimbangan. Keseimbangan akan menghasilkan kemampuan diri, suatu kekuatan yang sangat diperlukan untuk bertanggung jawab penuh atas pekerjaan, keluarga, kehidupan pribadi, sosial, dan spiritual. Dengan memiliki keseimbangan, seseorang dapat selalu siap dan berdaya penuh untuk melayani semua urusan kehidupan dengan penuh tanggung jawab. Keseimbangan inilah sarana untuk menggapai kebahagiaan dalam hidup.
Melalui buku ini, sang penulis, seorang trainer muda berbakat dalam bidang motivasi dan pengembangan diri, memandu pembaca untuk menemukan cara menggapai keseimbangan dengan bekerja tanpa mengabaikan aspek-aspek kehidupan yang seringkali dipertentangkan, seperti kehidupan pribadi, keluarga, spiritual, dan sosial. Buku ini dapat membantu Anda untuk memotivasi diri, meningkatkan manajemen diri, dan meningkatkan kualitas hidup melalui prinsip keharmonisan.",,https://tokoalvabet.com/483-large_default/hidup-seimbang-hidup-bahagia.jpg,https://tokoalvabet.com/53-large_default/hidup-seimbang-hidup-bahagia.jpg
